{
  "$schema": "https://json-schema.org/draft/2020-12/schema",
  "$id": "https://dabbler.ai/schemas/session-issues.schema.json",
  "title": "SessionIssues",
  "description": "Root-level structured verifier-findings artifact for one findings-bearing verification round. Written beside sN-verification.md as sN-issues.json (round 1) or sN-issues-round-<M>.json (later findings-bearing retries). It is durable, machine-readable persistence of the verifier's structured issue list. The presence of an sN-issues*.json file means that verification round found issues — VERIFIED rounds get no file. schemaVersion 1 (Set 055) keeps category/severity/resolution_status as loose strings. schemaVersion 2 (Set 057) promotes four optional finding fields (issueId, issueType, verificationMethod, suggestedTestOrCheck) and enum-enforces resolution_status + issueType when present; the fields stay advisory in semantics (no runtime gate reads them) — the enum is a spelling-drift guard. v1 files remain valid unchanged. Set 096 adds the optional verifier-emitted failureScenario string to the base issue object (both versions; additive, tolerant parse), and Set 096 S2 adds the phased-loop machinery fields: optional envelope-level phase / discoveryBaselineTree / fixVerdicts (omit-null; the ledger assembler and the remediation-review fix-delta lookup read discoveryBaselineTree tolerantly) and the optional per-issue discoveryCall on fanned-out discovery rounds. Set 111 S1 adds the optional per-issue discoveryLens beside it (the K fan-out calls now send differently-framed prompts over the same evidence, so the envelope records which lens reported each finding). Set 111 S2 adds the optional per-issue acceptance block (Proposal B: the closed question that settles the finding, executable where possible, judgment where not). See docs/session-issues-schema.md.",
  "type": "object",
  "additionalProperties": false,
  "required": [
    "schemaVersion",
    "sessionNumber",
    "verificationRound",
    "verificationVerdict",
    "issues"
  ],
  "properties": {
    "schemaVersion": {
      "description": "Envelope schema version. 1 = the v1 contract locked in Set 055 (loose advisory strings). 2 = the v2 contract locked in Set 057 (promoted optional finding fields + enum-enforced resolution_status / issueType).",
      "type": "integer",
      "enum": [1, 2]
    },
    "sessionNumber": {
      "description": "1-based session number within the set that this findings round belongs to.",
      "type": "integer",
      "minimum": 1
    },
    "verificationRound": {
      "description": "1-based verification round. Round 1 maps to sN-issues.json; round M>1 maps to sN-issues-round-<M>.json.",
      "type": "integer",
      "minimum": 1
    },
    "verificationVerdict": {
      "description": "The verifier verdict for this round. Because a clean round writes no file, a persisted artifact is expected to carry a non-VERIFIED verdict; the field is preserved verbatim so the artifact is self-describing.",
      "type": "string",
      "minLength": 1
    },
    "issues": {
      "description": "The verifier's structured issue list for this round. At least one issue is present (the file would not exist otherwise). On a fanned-out discovery round (Set 096 S2) this is the merged union of every completed call's findings. Under schemaVersion 2 each item additionally validates against IssueV2 (enum-enforced resolution_status / issueType, plus the optional promoted finding fields).",
      "type": "array",
      "minItems": 1,
      "items": { "$ref": "#/$defs/Issue" }
    },
    "phase": {
      "description": "Optional machinery field (Set 096 S2, omit-null): which verify_session --phase produced the round. Absent on classic (no --phase) rounds.",
      "type": "string",
      "enum": ["discovery", "supplementary", "remediation-review"]
    },
    "discoveryBaselineTree": {
      "description": "Optional machinery field (Set 096 S2, omit-null): the git tree sha (40-hex SHA-1 or 64-hex SHA-256) of the working-tree snapshot a discovery-family round recorded; --phase remediation-review diffs its fix delta from the most recent prior envelope carrying this field. Never written by remediation-review rounds.",
      "type": "string",
      "pattern": "^[0-9a-f]{40}([0-9a-f]{24})?$"
    },
    "fixVerdicts": {
      "description": "Optional machinery field (Set 096 S2, omit-null): a remediation-review round's parsed per-finding fix verdicts. Observability only — blocking classification reads the re-stated Issue blocks, never this field.",
      "type": "array",
      "items": {
        "type": "object",
        "additionalProperties": true,
        "required": ["finding", "verdict"],
        "properties": {
          "finding": {
            "type": "string",
            "minLength": 1
          },
          "verdict": {
            "type": "string",
            "enum": [
              "fix-accepted",
              "fix-rejected",
              "accepted-with-modification",
              "duplicate-of"
            ]
          },
          "ledgerId": {
            "description": "Optional (Set 096 S2 coverage): the ledger id (L1..Ln) the verdict line named; the CLI compares the parsed id set against the auto-ledger's numbered blocking findings exactly.",
            "type": "string",
            "pattern": "^L[0-9]+$"
          },
          "duplicateOf": {
            "description": "Present when verdict is duplicate-of: the ledger id whose disposition this occurrence follows (the reviewer's declared identity judgment for fan-out siblings / reworded restatements).",
            "type": "string",
            "pattern": "^L[0-9]+$"
          }
        }
      }
    }
  },
  "allOf": [
    {
      "if": {
        "required": ["schemaVersion"],
        "properties": { "schemaVersion": { "const": 2 } }
      },
      "then": {
        "properties": {
          "issues": {
            "items": { "$ref": "#/$defs/IssueV2" }
          }
        }
      }
    }
  ],
  "$defs": {
    "Issue": {
      "type": "object",
      "description": "One verifier finding (base / v1 contract). The verifier-emitted fields are preserved verbatim; description is the only reliable required field. category and severity are loose optional strings (the parser may emit 'unknown'). The resolution_* fields are optional, append-only, orchestrator-side annotations and are advisory only — they are NOT authoritative workflow state and no runtime gate consults them.",
      "additionalProperties": true,
      "required": ["description"],
      "properties": {
        "description": {
          "type": "string",
          "minLength": 1
        },
        "category": {
          "type": "string"
        },
        "severity": {
          "type": "string"
        },
        "failureScenario": {
          "description": "Optional verifier-emitted field (Set 096): the concrete failure scenario in which the finding's consequence materializes for a real user, with the probability justification the consequence-graded severity rubric requires. Parsed tolerantly from the 'Failure scenario:' line of an Issue block; its absence never changes blocking classification.",
          "type": "string",
          "minLength": 1
        },
        "discoveryCall": {
          "description": "Optional machinery field (Set 096 S2): on a fanned-out discovery round, which fan-out call reported the finding (1 = the canonical round artifact; k>=2 = the -fanout-<k> sibling). Absent on single-call rounds.",
          "type": "integer",
          "minimum": 1
        },
        "discoveryLens": {
          "description": "Optional machinery field (Set 111 S1): the discovery LENS the reporting fan-out call reviewed under, written beside discoveryCall on fanned-out discovery rounds. The K calls send differently-framed prompts over the same evidence ('spec-conformance' reads the plan toward the diff; 'failure-scenario' reads the code toward the ways it breaks), cycled by call index. Deliberately NOT enum-constrained: the lens list is code-side (verify_session.DISCOVERY_LENSES) and may grow without a schema bump. Absent on single-call rounds and on every non-discovery phase.",
          "type": "string",
          "minLength": 1
        },
        "acceptance": {
          "description": "Optional verifier-emitted field (Set 111 S2, Proposal B): the closed question that settles whether this finding is fixed, parsed tolerantly from the 'Acceptance criterion:' / 'Acceptance expectation:' lines of an Issue block. Its absence never changes blocking classification. kind='executable' carries a single command the acceptance harness may RUN against the pre-fix and fixed trees in disposable worktrees; kind='judgment' carries a prose sentence that is never executed and never auto-closes. A criterion auto-closes its finding ONLY on baseline discrimination (fails pre-fix AND passes post-fix, criterion unchanged, no remediation-modified test assets) — the harness, not this envelope, records that outcome (sN-acceptance-round-<M>.json).",
          "type": "object",
          "additionalProperties": false,
          "required": ["kind"],
          "properties": {
            "kind": {
              "description": "Which form the criterion takes. 'executable' = a runnable command (requires command); 'judgment' = a prose sentence a reviewer settles (requires statement).",
              "type": "string",
              "enum": ["executable", "judgment"]
            },
            "command": {
              "description": "The single command to run, verbatim from the verifier's backticked criterion. Shell operators are refused by the harness rather than interpreted (it spawns no shell), so a command carrying one is never executed.",
              "type": "string",
              "minLength": 1
            },
            "expectedExitCode": {
              "description": "The exit code that counts as PASS. Defaults to 0 when the verifier stated no expectation.",
              "type": "integer"
            },
            "expectedOutputContains": {
              "description": "Optional substring that must appear in the run's combined stdout+stderr for a PASS, in addition to the exit code.",
              "type": "string",
              "minLength": 1
            },
            "statement": {
              "description": "The one-sentence judgment criterion (kind='judgment'): what a reviewer must see to consider the finding fixed.",
              "type": "string",
              "minLength": 1
            }
          },
          "allOf": [
            {
              "if": {
                "required": ["kind"],
                "properties": { "kind": { "const": "executable" } }
              },
              "then": { "required": ["command"] }
            },
            {
              "if": {
                "required": ["kind"],
                "properties": { "kind": { "const": "judgment" } }
              },
              "then": { "required": ["statement"] }
            }
          ]
        },
        "resolution_status": {
          "description": "Advisory annotation: what the orchestrator did with this finding. Loose string under schemaVersion 1; enum-enforced under schemaVersion 2 (see IssueV2).",
          "type": "string"
        },
        "resolution_notes": {
          "description": "Advisory free-text annotation explaining the disposition of this finding.",
          "type": "string"
        },
        "resolved_in_round": {
          "description": "Advisory annotation: the verification round in which this finding was resolved.",
          "type": "integer",
          "minimum": 1
        }
      }
    },
    "IssueV2": {
      "description": "One verifier finding under the Set 057 v2 contract. Inherits the v1 base (description required, additionalProperties open) and adds: enum-enforced resolution_status / issueType WHEN PRESENT, plus four optional promoted finding fields (issueId, issueType, verificationMethod, suggestedTestOrCheck). All promoted fields stay OPTIONAL in the shared schema (additive). Set 057's Lightweight dedicated-verification flow imposed a stricter flow-layer requirement on a verifier-created open issue (issueId + issueType + verificationMethod); Set 112 removed that flow, and this schema is unchanged by either event.",
      "allOf": [ { "$ref": "#/$defs/Issue" } ],
      "properties": {
        "resolution_status": {
          "description": "Advisory annotation, enum-enforced under schemaVersion 2 (semantics stay advisory; the enum is a spelling-drift guard). No runtime gate reads it.",
          "type": "string",
          "enum": [
            "fixed",
            "not-reproducible",
            "accepted-risk",
            "accepted-consequence",
            "advisory-disagreement",
            "needs-more-context",
            "escalate-human"
          ]
        },
        "issueId": {
          "description": "Optional stable identifier the verifier assigns a finding so re-verification rounds and remediation sessions can reference it unambiguously.",
          "type": "string",
          "minLength": 1
        },
        "issueType": {
          "description": "Optional promoted classification of the finding, enum-enforced when present. deterministic-defect = a reproducible defect; contingent-risk = a conditional/latent risk; standards-departure = a convention/standards violation; missing-context = the verifier lacked context to judge.",
          "type": "string",
          "enum": [
            "deterministic-defect",
            "contingent-risk",
            "standards-departure",
            "missing-context"
          ]
        },
        "verificationMethod": {
          "description": "Optional one-line description of how the verifier reached this finding (the check it ran / would run).",
          "type": "string",
          "minLength": 1
        },
        "suggestedTestOrCheck": {
          "description": "Optional concrete test or check that would confirm the finding is fixed. Stays optional even in the dedicated-verification flow (often redundant with verificationMethod).",
          "type": "string",
          "minLength": 1
        }
      }
    }
  }
}
