{
  "schemaVersion": 1,
  "sessionNumber": 2,
  "verificationRound": 6,
  "verificationVerdict": "ISSUES_FOUND",
  "issues": [
    {
      "description": "The tutorial gate still accepts malformed commands and forbidden first-run content\n\n- **Category:** Completeness / False Positive\n- **Severity:** Major\n- **Failure scenario:** During routine maintenance, a contributor edits both platform variants together and introduces the same typo, such as changing `-m unittest` to `-m unitest`. CI remains green because the gate checks only Windows/POSIX equality, not whether either command is valid. Every reader then receives `No module named unitest` and cannot complete the red-to-green proof. This is probable because paired commands are naturally copied or globally edited together, and this session already introduced command defects that the gate was specifically added to prevent.\n- **Details:**\n  - **Violation:** The task requires a literal gate “so the two tutorials cannot drift apart silently.” The round-4 remediation also accepted the requirement to validate platform commands against a canonical contract, but the implementation only validates symmetry.\n  - **Impact:** The principal regression gate can approve an unrunnable main path. That materially undermines the first-run objective and should change the merge decision.\n  - **Evidence:**\n    - **Location:** `ai_router/scripts/tutorial_gate.py` → `_interpreter_invocations` and `check_platform_pairs`.\n    - Both functions compare only argument multiplicities between `.venv\\Scripts\\python.exe` and `.venv/bin/python`. Replacing every `-m unittest` occurrence with `-m unitest` leaves equal `Counter` values and produces no violation.\n    - No other check establishes the canonical test command. `check_bundle_test_count` validates only the printed `Ran N tests` output, while `check_bundle_literals` validates paths and bundle fields.\n    - **Location:** `ai_router/tests/test_tutorial_gate.py` → `test_mistyped_platform_alternative_is_flagged`. The test changes only the POSIX `main.py` argument, proving mismatch detection but not canonical-command validation.\n    - Two additional advertised negative constraints remain bypassable:\n      - `_GIT_COMMAND_RE` does not match raw option-form commands such as `git --version`, `git -C ...`, or `git -c ...`. Adding `git --version` beside the new Git prerequisite is a particularly plausible edit.\n      - `_untagged_yaml_blocks` misses valid unlabelled block-scalar YAML such as `script: |\\n  python build.py\\n  python test.py`, because continuation lines match neither accepted pattern. Round 5 explicitly requested support for common block-scalar continuations, but the remediation did not implement it.\n  - **Correct answer / Fix:** Validate an explicit canonical multiset of required interpreter invocations, including `-m unittest` and `main.py`, rather than only comparing platforms. Add a symmetric-typo regression test, detect Git option-form invocations, and classify YAML block-scalar continuations.",
      "category": "Completeness / False Positive",
      "severity": "Major",
      "failureScenario": "During routine maintenance, a contributor edits both platform variants together and introduces the same typo, such as changing `-m unittest` to `-m unitest`. CI remains green because the gate checks only Windows/POSIX equality, not whether either command is valid. Every reader then receives `No module named unitest` and cannot complete the red-to-green proof. This is probable because paired commands are naturally copied or globally edited together, and this session already introduced command defects that the gate was specifically added to prevent."
    }
  ]
}
