{
  "schemaVersion": 1,
  "sessionNumber": 2,
  "verificationRound": 3,
  "verificationVerdict": "ISSUES_FOUND",
  "issues": [
    {
      "description": "** The remediated CSS-ID quarantine rule misses selectors such as `button#save`\n  - **Category:** Correctness\n  - **Severity:** Major\n  - **Evidence paths:** `ai_router/scenario_lint.py, ai_router/tests/test_scenario_lint.py`\n  - **Failure scenario:** A web-scenario author pastes a common type-qualified selector such as `button#save` into an `action`. This form survives an unquoted YAML scalar because there is no whitespace before `#`. The negative lookbehind rejects the match because `#` follows the word character `n`, so lint and the corpus test remain clean while all generated documents publish target-specific mechanics. Type-qualified ID selectors are common outputs from browser tooling, making this a probable authoring path rather than an exotic edge case.\n  - **Acceptance criterion:** `python -c \"__import__('sys').exit(not any(r.name == 'css-id-selector' and r.pattern.search('Click button#save.') for r in (__import__('sys').path.insert(0, 'ai_router') or __import__('scenario_lint')).RULES))\"`\n  - **Acceptance expectation:** exit 0\n  - **Details:** **Violation:** The contract requires that “Playwright selectors and any other target-specific mechanics live in platform-specific blocks, never in the portable step semantics.” **Impact:** A common selector form bypasses the only corpus-enforced prose quarantine and is rendered into the portable walkthrough and training artifacts, materially defeating the session’s central portability seam. **Evidence:** `css-id-selector` uses `(?<![\\w#])#[A-Za-z_-][\\w-]*`; in `button#save`, the character before `#` is a word character, so the rule cannot match. The added tests cover only a standalone `#green-button` and therefore do not expose this remediation gap. The rule and its tests must also cover type-qualified ID selectors while preserving legitimate exclusions.",
      "category": "Correctness",
      "severity": "Major",
      "failureScenario": "A web-scenario author pastes a common type-qualified selector such as `button#save` into an `action`. This form survives an unquoted YAML scalar because there is no whitespace before `#`. The negative lookbehind rejects the match because `#` follows the word character `n`, so lint and the corpus test remain clean while all generated documents publish target-specific mechanics. Type-qualified ID selectors are common outputs from browser tooling, making this a probable authoring path rather than an exotic edge case.",
      "evidencePaths": [
        "ai_router/scenario_lint.py",
        "ai_router/tests/test_scenario_lint.py"
      ],
      "acceptance": {
        "kind": "executable",
        "command": "python -c \"__import__('sys').exit(not any(r.name == 'css-id-selector' and r.pattern.search('Click button#save.') for r in (__import__('sys').path.insert(0, 'ai_router') or __import__('scenario_lint')).RULES))\"",
        "expectedExitCode": 0
      }
    }
  ],
  "phase": "remediation-review",
  "fixVerdicts": [
    {
      "finding": "L1 The exemplar now declares the required clone and repository-root context",
      "verdict": "fix-accepted",
      "ledgerId": "L1"
    },
    {
      "finding": "L2",
      "verdict": "duplicate-of",
      "duplicateOf": "L1",
      "ledgerId": "L2"
    },
    {
      "finding": "L3 The CSS-ID rule still misses common type-qualified selectors",
      "verdict": "fix-rejected",
      "ledgerId": "L3"
    }
  ]
}
