{
  "schemaVersion": 1,
  "sessionNumber": 3,
  "verificationRound": 1,
  "verificationVerdict": "ISSUES_FOUND",
  "issues": [
    {
      "description": "** The new environment-fault Layer 3 test does not deterministically create an environment fault.\n  - **Category:** Correctness\n  - **Severity:** Major\n  - **Failure scenario:** A maintainer runs the mandatory full Playwright suite in the normal configured development environment, where a provider key and system Python are available. The fixture then has no status fault, so `dabblerSessionSets.setupNeeded` remains false and `openSessionSetsView()` times out waiting for a pane that correctly does not exist. This is probable because the project’s routed development environment uses provider credentials and the test host inherits `process.env`.\n  - **Details:** **Violation:** The session must end with “Layer 3 is green on the new view,” and the test claims that “no engine files and no venv fails the workspace-initialization probe.” **Impact:** The required full-suite gate can fail based on the runner’s environment rather than product correctness, blocking close or release. **Evidence:** In `src/test/playwright/system-status.spec.ts`, the fixture contains a session set. In `src/providers/systemStatus.ts`, `workspaceInitialized` is explicitly `hasAnySets || detectCompletion(...).structureBuilt`, so it is always `true` for this fixture. The remaining possible faults depend on inherited provider credentials, system Python, CLI presence, tier, and transport profile. The test’s stated reason for expecting the pane is therefore false. **Correct answer:** Use an empty workspace with no scaffold artifacts so `hasAnySets === false` and `workspaceInitialized === false`, or explicitly sanitize/inject the extension-host environment and assert the exact deterministic fault.",
      "category": "Correctness",
      "severity": "Major",
      "failureScenario": "A maintainer runs the mandatory full Playwright suite in the normal configured development environment, where a provider key and system Python are available. The fixture then has no status fault, so `dabblerSessionSets.setupNeeded` remains false and `openSessionSetsView()` times out waiting for a pane that correctly does not exist. This is probable because the project’s routed development environment uses provider credentials and the test host inherits `process.env`.",
      "discoveryCall": 2
    }
  ],
  "phase": "discovery",
  "discoveryBaselineTree": "5728b5d8959c35830ea8b5b78ecd0b91de730247"
}
